EventName,StartDate,EndDate,Time,Venue,Address,City,State,Zip,Category,EventType,PrizeMoney,Description,Website,Phone,Email,SourceImage,DateExtracted,TeamRopingAI
CMSA Western US Championship,7/23/26,7/26/26,,South Point Arena & Equestrian Center,9777 Las Vegas Blvd South,Las Vegas,NV,89183.0,Mounted Shooting,Championship,,CMSA Western US Championship at South Point Arena in Las Vegas. Four days of Cowboy Mounted Shooting Association western regional championship competition. Riders in period costume shoot balloon targets at full gallop. Free to the public. Visit cmsaevents.com for division and entry info.,https://cmsaevents.com/,702-797-8005,,,3/25/26,NO
Turquoise Circuit PRCA Rodeo - Lovington NM Lea County Fair,7/31/26,8/8/26,,Lea County Fair & Rodeo Grounds,,Lovington,NM,,Rodeo,PRCA Rodeo,,"Turquoise Circuit PRCA Pro Rodeo at the Lea County Fair in Lovington, NM. Nine days of professional rodeo and fair activities in southeastern New Mexico. Features all PRCA events. One of the longer-running circuit events on the New Mexico leg of the Turquoise Circuit. Visit leacountyfair.net.",https://www.leacountyfair.net,,,,3/25/26,NO
Pacific Ridge Show Jumping - Summer 3,8/7/26,8/9/26,8:00 AM,Los Angeles Equestrian Center,480 W Riverside Dr,Burbank,CA,91506.0,Hunter/Jumper,National Horse Show,,Pacific Ridge Show Jumping Summer 3 at LAEC — part of the 10-event 2026 series spanning April through October at the Los Angeles Equestrian Center in Burbank. National-level hunter/jumper competition with new footing upgrades. Free for spectators. Entries at prsj.showgroundslive.com.,https://pacificridgeshowjumping.com,818-840-9063,,,3/25/26,NO
The Run For A Million,8/12/26,8/15/26,,South Point Arena & Equestrian Center,9777 Las Vegas Blvd South,Las Vegas,NV,89183.0,Reining,Championship,"$1,000,000","The Run For A Million at South Point Arena — the richest reining event in the world with a $1 million purse. Features Reining, Cutting Horse Challenge, Cow Horse Challenge, Youth and Non-Pro events. Free general admission with ticketed championship nights. Visit therunforamillion.com.",https://therunforamillion.com/,702-797-8005,,,3/25/26,NO
National Stock Horse Association Futurity and Derby,8/18/26,8/23/26,,South Point Arena & Equestrian Center,9777 Las Vegas Blvd South,Las Vegas,NV,89183.0,Stock Horse,Futurity/Derby,,"National Stock Horse Association Futurity and Derby at South Point Arena in Las Vegas. Six days of NSHA competition showcasing top stock horses in ranch riding, reining and cow horse events. Free to the public. Visit nationalstockhorse.com for class schedule and entry details.",https://nationalstockhorse.com/,702-797-8005,,,3/25/26,NO
Will Rogers Polo Club - Equidome Women's Challenge,8/19/26,8/20/26,,Los Angeles Equestrian Center,480 W Riverside Dr,Burbank,CA,91506.0,Polo,Arena Polo Tournament,,Will Rogers Polo Club Equidome Women's Challenge arena polo tournament at LAEC. Two days of women's arena polo competition inside the iconic Equidome. Free for spectators. An exciting and accessible introduction to the sport of polo for Los Angeles fans. Visit thelaec.com for details.,https://thelaec.com,818-840-9063,,,3/25/26,NO
Turquoise Circuit PRCA Rodeo - Payson (Late Summer),8/21/26,8/22/26,,Payson Rodeo Grounds,,Payson,AZ,,Rodeo,PRCA Rodeo,,"Turquoise Circuit PRCA Pro Rodeo in Payson, AZ — late summer edition. Two days of professional rodeo in the cool Arizona Rim Country. Payson hosts two Turquoise Circuit rodeos per year. Features all PRCA events. Visit paysonprorodeo.com for tickets, schedule and competitor information.",https://www.paysonprorodeo.com,,,,3/25/26,NO
Turquoise Circuit PRCA Rodeo - Socorro NM County Fair,8/24/26,8/25/26,,Socorro County Fairgrounds,,Socorro,NM,,Rodeo,PRCA Rodeo,,"Turquoise Circuit PRCA Pro Rodeo at the Socorro County Fair in Socorro, NM. Two days of professional rodeo and county fair events in central New Mexico. Features all PRCA events. Visit socorronm.gov for schedule and event details.",https://www.socorronm.gov/events/socorro-county-fair-rodeo/,,,,3/25/26,NO
Turquoise Circuit PRCA Rodeo - Scottsdale (Fall),9/1/26,9/30/26,,WestWorld of Scottsdale,16601 N Pima Rd,Scottsdale,AZ,85260.0,Rodeo,PRCA Rodeo,,"Turquoise Circuit PRCA Pro Rodeo in Scottsdale, AZ — fall edition. Date TBA. Professional rodeo featuring all PRCA events at WestWorld of Scottsdale. One of two Scottsdale stops on the Turquoise Circuit. Visit rodeoscottsdale.com for confirmed dates and ticket information.",https://rodeoscottsdale.com,,,,3/25/26,NO
Buckles and Barrels for Bailey,9/4/26,9/6/26,,South Point Arena & Equestrian Center,9777 Las Vegas Blvd South,Las Vegas,NV,89183.0,Barrel Racing,Charity Event,,"Buckles and Barrels for Bailey at South Point Arena in Las Vegas. Three days of barrel racing competition and celebration raising funds for a meaningful cause. Free to the public. Visit bucklesandbarrels4bailey.com for entry information, divisions and schedule.",https://bucklesandbarrels4bailey.com/,702-797-8005,,,3/25/26,NO
Schooling Show (NACADA) - Freeman Farms,9/5/26,9/5/26,,Freeman Farms,1096 E. Road 3 South,Chino Valley,AZ,86323.0,Dressage,Schooling Show,,"September NACADA schooling show at Freeman Farms in Chino Valley features classical and western dressage tests with a supportive show atmosphere. A strong tune-up before fall championships and recognized shows, with an emphasis on learning and good horsemanship. See NACADA's entry page for the latest details and forms.",https://azdressage.org/event/schooling-show-nacada/2026-09-05/,,,,1/26/26,NO
High Roller Reining Classic Horse Show,9/10/26,9/17/26,,South Point Arena & Equestrian Center,9777 Las Vegas Blvd South,Las Vegas,NV,89183.0,Reining,Classic,,"High Roller Reining Classic at South Point Arena in Las Vegas. Eight days of premier NRHA-affiliated reining competition. One of the most prestigious reining events of the fall season with Open, Non-Pro, Amateur and Youth divisions. Free to the public. Visit highrollerreiningclassic.com.",http://www.highrollerreiningclassic.com/,702-797-8005,,,3/25/26,NO
Turquoise Circuit PRCA Rodeo - New Mexico State Fair Albuquerque,9/10/26,9/20/26,,New Mexico State Fairgrounds,300 San Pedro Dr NE,Albuquerque,NM,87108.0,Rodeo,PRCA Rodeo,,Turquoise Circuit PRCA Pro Rodeo at the New Mexico State Fair in Albuquerque. Eleven days of professional rodeo at one of the largest state fairs in the Southwest. Features all PRCA events. A major Turquoise Circuit points event drawing top competitors from AZ and NM. Visit statefair.exponm.com.,https://statefair.exponm.com,,,,3/25/26,NO
Pacific Ridge Show Jumping - Fall 1,9/11/26,9/13/26,8:00 AM,Los Angeles Equestrian Center,480 W Riverside Dr,Burbank,CA,91506.0,Hunter/Jumper,Regional Horse Show,,Pacific Ridge Show Jumping Fall 1 at LAEC — part of the 10-event 2026 series spanning April through October at the Los Angeles Equestrian Center in Burbank. Regional-level hunter/jumper competition with new footing upgrades. Free for spectators. Entries at prsj.showgroundslive.com.,https://pacificridgeshowjumping.com,818-840-9063,,,3/25/26,NO
RVR Trail Ride 2026,9/16/26,9/20/26,,Coconino National Forest,,,AZ,,Trail Ride,Social Event,,"Save the date for the Rio Verde Roverettes All Woman's Trail Ride 2026! This year's theme celebrates America's Birthday - 250 Years. The multi-day trail ride takes place in the beautiful Coconino National Forest, offering scenic riding through Arizona's high country. This popular annual event brings together women riders for camaraderie, adventure, and appreciation of the outdoors on horseback. Invitations and detailed information will be emailed out June 1. Perfect for experienced trail riders looking for a memorable group riding experience in one of Arizona's most scenic forests.",rioverderoverettes.com,,rexwager@aol.com,616837201_26238980362352796_2752012080774694289_n.jpg,1/25/26,NO
Scottsdale Saddle Club Gymkhana - September 19,9/19/26,9/19/26,,Scottsdale Rodeo Grounds,,Scottsdale,AZ,,Gymkhana,Series,,"Scottsdale Saddle Club gymkhana at the Rodeo Grounds featuring professional grade ground and facilities with divisions for every level of rider. Part of the 2026 season series running monthly through December. Visit scottsdalesaddleclub.com for full details, classes, and entry information.",www.scottsdalesaddleclub.com,,,634950103_1372842801313322_1568601591476657115_n.jpg,3/6/26,NO
PCCHA Holy Cow Performance Horses and Super Futurity,9/21/26,9/26/26,,South Point Arena & Equestrian Center,9777 Las Vegas Blvd South,Las Vegas,NV,89183.0,Cutting,Futurity,,PCCHA Holy Cow Performance Horses and Super Futurity at South Point Arena in Las Vegas. Six days of Pacific Coast Cutting Horse Association futurity competition featuring young horses and top trainers competing for major prizes. Free to the public. Visit pccha.com for full schedule.,https://pccha.com/,702-797-8005,,,3/25/26,NO
Scottsdale Saddle Club Gymkhana - October 3,10/3/26,10/3/26,,Scottsdale Rodeo Grounds,,Scottsdale,AZ,,Gymkhana,Series,,"Scottsdale Saddle Club gymkhana at the Rodeo Grounds featuring professional grade ground and facilities with divisions for every level of rider. Part of the 2026 season series running monthly through December. Visit scottsdalesaddleclub.com for full details, classes, and entry information.",www.scottsdalesaddleclub.com,,,634950103_1372842801313322_1568601591476657115_n.jpg,3/6/26,NO
Arizona Cutting Horse Association - Oktoberfest,10/13/26,10/18/26,8:00 AM,Horseshoe Park & Equestrian Centre,20464 E Riggs Road,Queen Creek,AZ,85142.0,Cutting,NCHA Sanctioned Show,,"Arizona Cutting Horse Association Oktoberfest at Horseshoe Park — six days of fall NCHA-sanctioned cutting horse competition. Open, Non-Pro, Amateur, Limited and Youth divisions. One of AZCHA's premier fall events kicking off the new season. Contact Kathy Unfried 928-277-6103 or arizonacuttinghorse@gmail.com.",https://azcha.com,480-358-3793,,,3/25/26,NO
Pacific Ridge Show Jumping - Fall 2 (Finals),10/16/26,10/18/26,8:00 AM,Los Angeles Equestrian Center,480 W Riverside Dr,Burbank,CA,91506.0,Hunter/Jumper,National Horse Show,,Pacific Ridge Show Jumping Fall 2 (Finals) at LAEC — part of the 10-event 2026 series spanning April through October at the Los Angeles Equestrian Center in Burbank. National-level hunter/jumper competition with new footing upgrades. Free for spectators. Entries at prsj.showgroundslive.com.,https://pacificridgeshowjumping.com,818-840-9063,,,3/25/26,NO
K/A Productions - SCHSA Hunter Derby Finals,10/16/26,10/18/26,8:00 AM,Los Angeles Equestrian Center,480 W Riverside Dr,Burbank,CA,91506.0,Hunter/Jumper,National Horse Show,,"K/A Productions SCHSA Hunter Derby Finals at LAEC — featuring the $15,000 SCHSA Hunter Derby Finals, jumper classics and costume classes. Three days of competition with year-end division champions. Free for spectators. Visit ka-productions.com.",https://www.ka-productions.com,818-840-9063,,,3/25/26,NO
APHA Western National Championship,10/22/26,10/25/26,,South Point Arena & Equestrian Center,9777 Las Vegas Blvd South,Las Vegas,NV,89183.0,Paint Horse Show,National Championship,,"APHA Western National Championship at South Point Arena in Las Vegas. Four days of American Paint Horse Association national-level competition for western performance, halter and pleasure horses. Free to the public. Visit apha.com for class schedule, entry info and hotel group rates.",http://apha.com/western-national-show/,702-797-8005,,,3/25/26,NO
Pacific Ridge Show Jumping - Fall 3,10/23/26,10/25/26,8:00 AM,Los Angeles Equestrian Center,480 W Riverside Dr,Burbank,CA,91506.0,Hunter/Jumper,Regional Horse Show,,Pacific Ridge Show Jumping Fall 3 at LAEC — part of the 10-event 2026 series spanning April through October at the Los Angeles Equestrian Center in Burbank. Regional-level hunter/jumper competition with new footing upgrades. Free for spectators. Entries at prsj.showgroundslive.com.,https://pacificridgeshowjumping.com,818-840-9063,,,3/25/26,NO
The Desert Crown Youth Rodeo,10/30/26,11/1/26,,Buckeye Equestrian & Events Center,10300 S Miller Rd,Buckeye,AZ,85326.0,Rodeo,Rodeo,,The Desert Crown Youth Rodeo at Buckeye Equestrian and Events Center. Presented by Paloma Ready Mix and Materials. Arizona High School Rodeo Association sanctioned event featuring youth rodeo competition over three days. A premier youth rodeo in the Phoenix metro area.,buckeyearena.com,,,646860369_1564401359021032_4674146119608604638_n.jpg,3/6/26,YES
American Bucking Bull Inc World Finals,10/31/26,11/5/26,,South Point Arena & Equestrian Center,9777 Las Vegas Blvd South,Las Vegas,NV,89183.0,Bull Riding,World Finals,,American Bucking Bull Inc (ABBI) World Finals at South Point Arena in Las Vegas. Six days of championship bull riding and bucking bull competition with the world's top bulls and riders. Free to the public. Visit americanbuckingbull.com for full schedule and competition details.,http://www.americanbuckingbull.com/,702-797-8005,,,3/25/26,NO
Turquoise Circuit Finals Rodeo,11/5/26,11/7/26,,Cave Creek Memorial Arena Rodeo Grounds,37201 N 28th St,Cave Creek,AZ,85331.0,Rodeo,PRCA Circuit Finals,,Turquoise Circuit Finals Rodeo in Cave Creek — the championship event for the PRCA Turquoise Circuit covering Arizona and New Mexico. Top two qualifiers from each event advance to the RAM National Circuit Finals. Three nights of elite rodeo with VIP Turquoise Trail Lounge and High Desert Sky Box options. Tickets at turquoisecircuitfinalsrodeo.com.,https://www.turquoisecircuitfinalsrodeo.com,,,,3/25/26,NO
ADA Fall Fiesta (Double Show) & Arizona State Dressage Championships,11/7/26,11/8/26,,WestWorld of Scottsdale,16601 N Pima Rd,Scottsdale,AZ,85260.0,Dressage,Rated Show,,"ADA's Fall Fiesta is a two-day USDF/USEF recognized double show that also hosts the Arizona State Dressage Championships at WestWorld of Scottsdale. Riders compete for qualifying scores, year-end recognition, and state championship titles across multiple levels and divisions, including Para and Western Dressage. A marquee fall destination show for Arizona dressage.",https://azdressage.org/event/fall-fiesta-recognized-show-arizona-state-dressage-championship/2026-11-07/,,,,1/26/26,NO
Marshall Sterling USHJA National Championships,11/9/26,11/15/26,,South Point Arena & Equestrian Center,9777 Las Vegas Blvd South,Las Vegas,NV,89183.0,Hunter/Jumper,National Championship,,"Marshall+Sterling/USHJA National Championships at South Point Arena in Las Vegas. Seven days of US Hunter Jumper Association national championship competition for hunters, jumpers and equitation riders of all levels. Free to the public. Visit ushja.org for class schedule and qualifying requirements.",https://www.ushja.org/competition/national-championship,702-797-8005,,,3/25/26,NO
CINCH All Star Super Sort,11/20/26,11/22/26,,South Point Arena & Equestrian Center,9777 Las Vegas Blvd South,Las Vegas,NV,89183.0,Ranch Sorting,Championship,,"CINCH All Star Super Sort at South Point's Priefert Pavilion in Las Vegas. Three days of premier ranch sorting competition sponsored by CINCH. Open to competitors of all skill levels. Free to the public. Visit rsnc.us for entry information, divisions and full schedule.",https://rsnc.us/,702-797-8005,,,3/25/26,NO
Scottsdale Saddle Club Gymkhana - November 22,11/22/26,11/22/26,,Scottsdale Rodeo Grounds,,Scottsdale,AZ,,Gymkhana,Series,,"Scottsdale Saddle Club gymkhana at the Rodeo Grounds featuring professional grade ground and facilities with divisions for every level of rider. Part of the 2026 season series running monthly through December. Visit scottsdalesaddleclub.com for full details, classes, and entry information.",www.scottsdalesaddleclub.com,,,634950103_1372842801313322_1568601591476657115_n.jpg,3/6/26,NO
The Cup Series - Turkey Cup,11/26/26,11/26/26,,Dillon's Western Trails Arena,,Morristown,AZ,,Barrel Racing,Championship,"$6,400+ to 1st","The Cup Series presents The Turkey Cup barrel race at Dillon's Western Trails Arena. In conjunction with Dillon's Thanksgiving Day Race. Entries open Nov 1. $600 entry fee, limited to 200 entries. Projected payout with 80% back and 200 entries: 1st $6,400 & Trophy Cup, 2nd $5,760, 3rd $4,800, 4th $4,000, 5th $3,200, 6th $2,560, 7th $1,920, 8th $1,280, 9th $1,120, 10th $960. Times can be carried over from each run throughout the race. Trophy cups to each D winner. 3D equal payouts on 0.6 splits.",ssrproductions.org,435-681-0058,,623366934_122183836310660250_2648107888808350311_n.jpg,2/1/26,NO
Scottsdale Saddle Club Gymkhana - December 5,12/5/26,12/5/26,,Scottsdale Rodeo Grounds,,Scottsdale,AZ,,Gymkhana,Series,,"Scottsdale Saddle Club gymkhana at the Rodeo Grounds featuring professional grade ground and facilities with divisions for every level of rider. Part of the 2026 season series running monthly through December. Visit scottsdalesaddleclub.com for full details, classes, and entry information.",www.scottsdalesaddleclub.com,,,634950103_1372842801313322_1568601591476657115_n.jpg,3/6/26,NO
Dressage at Spear-Cross (Recognized Level 2 Show),12/12/26,12/13/26,9:00 AM,Spear-Cross Equine Center of Scottsdale,28475 N. 84th Street,Scottsdale,AZ,85266.0,Dressage,Rated Show,,Year-end Dressage at Spear-Cross recognized Level 2 show in Scottsdale. Two days of competition with licensed judging and a professional show setup at Spear-Cross Equine Center. A strong December option for riders targeting late-season qualifying scores and championship preparation. Check the event page for specifics and updates.,https://azdressage.org/event/dressage-at-spear-cross-2/,(480) 650-9661,,,1/26/26,NO
Silver Dollar Circuit,1/12/27,1/16/27,,TBD,,Las Vegas,NV,,Quarter Horse Show,Circuit Show,,"Silver Dollar Circuit returns to fabulous Las Vegas January 12–16, 2027 with new dates. A premier destination horse show event drawing competitors from across the southwest. Plan ahead for this multi-day circuit show in Las Vegas, Nevada.",,,,651686744_1377698231053258_4361322221383422508_n.jpg,3/24/26,NO
Zabawa Production Weekly Ropings - Friday #8.5,Fridays,,9:00 AM,Zabawa Arena,48069 W Papago Rd,Maricopa,AZ,,Team Roping,Weekly Jackpot,,"#8.5 roping capped at 4+. $150 entry, 3-steer progressive, 80% payback. Cash only.",,484-226-5961,,615515000_1565460128385179_3288440395961003483_n.jpg,1/25/26,YES
5 Flat Productions Monday Ropings,Mondays,,9:00 AM,Flying E Ranch,2801 W Wickenburg Way,Wickenburg,AZ,85390.0,Team Roping,Weekly Jackpot,80% Payout,"30+ and Ladies. #12.5, #11.5, #10.5 divisions. $125/roper, 4-steer PA1, enter 3x. Fresh cattle. Cash only.",,970-846-7825,,617960131_1704995653843884_2689894101989205811_n.jpg,1/25/26,YES
Zabawa Production Weekly Ropings - Monday #9.5,Mondays,,,Zabawa Arena,48069 W Papago Rd,Maricopa,AZ,,Team Roping,Weekly Jackpot,,"#9.5 roping for 40+ or any age ladies, capped at 5+. $150 entry, 3-steer progressive, 80% payback. Cash only.",,484-226-5961,,615515000_1565460128385179_3288440395961003483_n.jpg,1/25/26,YES
Team Roping Lessons with Cesar de la Cruz,Ongoing,,9:00 AM,,,Casa Grande,AZ,,Team Roping,Clinic,,"Train with 9-time NFR heeler Cesar de la Cruz in Casa Grande, Arizona. With over $1.3 million in lifetime earnings and three PRCA Tour Finale titles, Cesar brings elite-level experience to every lesson. Private and semi-private sessions are available for ropers of all skill levels looking to improve their technique, timing, and competitive edge. Whether you're working on your swing, positioning, or horse handling, Cesar provides personalized coaching tailored to your goals. His philosophy focuses on giving students all the tools for success in the arena. Contact via social media using #RopeWithCesar to schedule your session and take your heeling to the next level.",,,,574396100_1360897145404590_337187081454450241_n.jpg,1/25/26,YES
4D Arena Saturday Breakaway,Saturday,Saturday,"Books Close at 10:30 AM, Rope at 11:00 AM",4D Arena,23465 W Patton Rd,Wittmann,AZ,85361.0,Breakaway,Jackpot,,Open Breakaway every Saturday. 3 Head Progressive. Bell Collar Catch Only. Starts with the Open. March 14th will be $200/run in the Open. Cash Only. All ropings are 2/3rd payback unless specified. Ropings nominated for WCRA. Sponsored by Roping Finder & Akins Trailer Sales.,,(719) 539-5507,,645757754_950014267692249_3872782235165094531_n.jpg,3/6/26,YES
4D Arena Saturday Breakaway,Saturdays,,12:00 PM,4D Arena,23465 W Patton Rd,Wittmann,AZ,85361.0,Breakaway Roping,Weekly Series,Cash Prizes,"4D Arena Breakaway every Saturday! Books close at 10:30am, rope at 11:00am. Starts with the open. OPEN BREAKAWAY: $120 entry, Enter 4x max, 3 head progressive, bell collar catch only. NOVICE BREAKAWAY: $120 entry, Enter 4x max, straight 2 head average. Novice eligibility - must meet ONE: Woman over 50, kid under 12, or roper/horse with less than $1500 lifetime earnings. Cash only! All ropings are 2/3rd payback unless specified. Ropings are nominated for WCRA. Sponsored by Roping Finder and Akins Trailer Sales. Follow Hot Shot Equine and 4D Arena on Facebook for updates.",,(719) 539-5507,,620032530_918872384139771_7101876432825736538_n.jpg,1/27/26,YES
High Call Productions Saturday Ropings,Saturdays,,11:00 AM,Flying E Ranch,2801 Wickenburg Way,Wickenburg,AZ,,Team Roping,Weekly Series,,"High Call Productions offers weekend team roping at Flying E Ranch. Books open 9am, close 10am, rope at 10:15am. SATURDAYS (Over 40 & All Ladies): #12.5 Handicap - 4-steer $100/man, enter 3x, 80% payback. #8.5 Handicap (50+ & Ladies) - 3-steer $120/man, enter 3x or draw up to 6. #9.5 Handicap (50+ & Ladies) - 4-steer $150/man, enter 2x or draw up to 4, 70% payback. SUNDAYS (All Ages): #7.5 Handicap - 3-steer $120/man, knives to average winners. #9.5 Handicap - 3-steer $120/man. #11.5 Handicap - 4-steer $150/man, 70% payback. Cash only. USTRC/WSTR card required.",,214-585-2632,,622266550_1277474227771655_3884098997596505531_n.jpg,1/25/26,YES
4D Arena Sunday Funday,Sundays,,9:00 AM,4D Arena,23465 W Patton Rd,Wittmann,AZ,85361.0,Team Roping,Weekly Series,Trophy Buckles,"Weekly Sunday ropings. #7.5 over 40/ladies $100/man, #8.5 $120/man, #9.5 Handicap $120/man. Trophy buckles.",,(719) 539-5507,,616772801_916377151055961_6604103686076692976_n.jpg,1/25/26,YES
High Call Productions Sunday Ropings,Sundays,,10:00 AM,Flying E Ranch,2801 Wickenburg Way,Wickenburg,AZ,,Team Roping,Weekly Series,Knives,"High Call Productions offers weekend team roping at Flying E Ranch. Books open 9am, close 10am, rope at 10:15am. SATURDAYS (Over 40 & All Ladies): #12.5 Handicap - 4-steer $100/man, enter 3x, 80% payback. #8.5 Handicap (50+ & Ladies) - 3-steer $120/man, enter 3x or draw up to 6. #9.5 Handicap (50+ & Ladies) - 4-steer $150/man, enter 2x or draw up to 4, 70% payback. SUNDAYS (All Ages): #7.5 Handicap - 3-steer $120/man, knives to average winners. #9.5 Handicap - 3-steer $120/man. #11.5 Handicap - 4-steer $150/man, 70% payback. Cash only. USTRC/WSTR card required.",,214-585-2632,,622266550_1277474227771655_3884098997596505531_n.jpg,1/25/26,YES
Western Trails Arena Heel-O-Matic Practice,Tuesdays,,5:00 PM,Western Trails Arena,37839 W Grand Ave,Morristown,AZ,85342.0,Team Roping,Practice,,"Western Trails ""The Bar"" offers weekly Heel-O-Matic practice sessions every Tuesday in Morristown. The morning begins with Heel-O-Matic Dummy Practice from 10:00-11:00 AM ($20/horse), followed by Live Cattle Practice from 11:00 AM-1:00 PM ($40/horse, $25 additional horses). This is an ideal opportunity for ropers to work on their timing and technique in a low-pressure environment with quality cattle. Whether you're tuning up your heel horse or developing your skills, Western Trails provides a professional practice setting with experienced management.",,(208) 899-2621,,615480124_25543813098636346_4702449521010503637_n.jpg,1/25/26,YES
Zabawa Production Weekly Ropings - Tuesday #12.5,Tuesdays,,4:15 PM,Zabawa Arena,48069 W Papago Rd,Maricopa,AZ,,Team Roping,Weekly Jackpot,,"#12.5 Slide Tuesday Night. $200 entry, 4-steer progressive handicapped, 80% payback. Cash only.",,484-226-5961,,615515000_1565460128385179_3288440395961003483_n.jpg,1/25/26,YES
Tom Wicklund Drills & Maneuvers - Weekly Classes,Tuesdays/Wednesdays/Thursdays,,5:30 PM,Performance Horse Arena,Corner of 24th and Maddock,Cave Creek,AZ,,Clinic,Weekly Classes,$30 ,"Weekly group horsemanship classes with Tom Wicklund at Performance Horse Arena. Tuesdays and Wednesdays at 5:30 PM, Thursdays at 10 AM. Focus on balance, hind quarters, forehand, and flexing. All disciplines and breeds welcome. New topics each week. $30 per session, space limited, pre-register.",www.performancehorsearena.com,,,Screenshot_2026-03-06_at_8_00_58_AM.png,3/6/26,NO
4D Arena Workin Man Wednesdays,Wednesdays,,9:30 AM,4D Arena,23465 W Patton Rd,Wittmann,AZ,85361.0,Team Roping,Weekly Series,,"Weekly afternoon/evening ropings. #11.5 Handicap $150/man, #12.5 Slide $150/man. 4-head progressive.",,(719) 539-5507,,616772801_916377151055961_6604103686076692976_n.jpg,1/25/26,YES
4D Arena Wrangler Wednesdays,Wednesdays,,,4D Arena,23465 W Patton Rd,Wittmann,AZ,85361.0,Team Roping,Weekly Series,Trophy Buckles,"Weekly morning ropings. #6.5 $50/man, #7.5 $60/man, #8.5 $60/man. All 2-steer with trophy buckles. Wrangler certificates to high money.",,(719) 539-5507,,616772801_916377151055961_6604103686076692976_n.jpg,1/25/26,YES
Twisted N Productions Wednesday Round Robin,Wednesdays,,6:00 PM,Bottoms Up Horse Arena & RV Park,4300 E Laughlin Rd,Casa Grande,AZ,,Team Roping,Round Robin,2/3 Payout,"Twisted N Productions weekly Wednesday round robin at Bottoms Up Horse Arena in Casa Grande. $200/man, 15 headers and 15 heelers. Starts at 6 PM. Call to enter. A great mid-week roping opportunity in the Casa Grande area. Call/text 602-541-8880 for entries.",,602-541-8880,,Screenshot_2026-03-06_at_10_29_57_AM.png,3/6/26,YES
